[
  {
    "change_id": "chg_0001",
    "change_date": "2026-07-12",
    "database_version": "1.0.0",
    "affected_tab": "all",
    "affected_record_ids": "all_v1_records",
    "change_type": "initial_release",
    "previous_value": "",
    "new_value": "Initial male-specific evidence database release",
    "reason_for_change": "Created normalized evidence, application rules, exports, methodology, and validation package.",
    "supporting_study_ids": "stu_0001|stu_0004|stu_0016|stu_0019",
    "reviewer_notes": "Version 1.0 is broad but not an exhaustive systematic review; low-confidence operational defaults are explicitly labeled."
  },
  {
    "change_id": "chg_0002",
    "change_date": "2026-07-12",
    "database_version": "2.0.0",
    "affected_tab": "exercise_database|muscle_group_recommendations",
    "affected_record_ids": "ex_cambered_barbell_bench_press|mg_chest_sternal",
    "change_type": "exercise_library_addition",
    "previous_value": "Cambered bench aliases were not discoverable.",
    "new_value": "Added one canonical cambered-barbell bench record with three aliases and normal chest mapping.",
    "reason_for_change": "Exercise discovery must evaluate eligible canonical library variations instead of silently omitting unrecognized aliases.",
    "supporting_study_ids": "stu_0004|stu_0009|stu_0010|stu_0011",
    "reviewer_notes": "This is a movement-specific research default, not a claim that camber geometry guarantees superior hypertrophy."
  },
  {
    "change_id": "chg_0003",
    "change_date": "2026-07-12",
    "database_version": "2.0.0",
    "affected_tab": "exercise_muscle_map|exercise_taxonomy_review_queue",
    "affected_record_ids": "all_exercise_muscle_relationships",
    "change_type": "breaking_taxonomy_migration",
    "previous_value": "Primary 1.0 and blanket secondary 0.5 relationships generated from legacy exercise columns.",
    "new_value": "Taxonomy 2.0.0: direct, fractional, incidental, isometric, and unknown relationships with exercise-specific credit, fatigue, confidence, evidence, and review metadata.",
    "reason_for_change": "Hypertrophy volume and fatigue exposure require different semantics, and compound exercises require multi-muscle biomechanical classification.",
    "supporting_study_ids": "stu_0001|stu_0009|stu_0010|stu_0011|stu_0041|stu_0042",
    "reviewer_notes": "Weights are transparent programming conventions, not proven physiological constants; low-confidence entries remain queued."
  }
]
